{
  "$schema": "https://json-schema.org/draft/2020-12/schema",
  "type": "object",
  "properties": {
    "schema_version": {
      "type": "string",
      "const": "exploit-handoff/v1"
    },
    "finding_id": {
      "type": "string",
      "pattern": "^FIND-[A-Za-z0-9-]+$"
    },
    "title": {
      "type": "string",
      "minLength": 1
    },
    "status": {
      "type": "string",
      "const": "validated"
    },
    "severity": {
      "type": "string",
      "enum": [
        "critical",
        "high",
        "medium",
        "low"
      ]
    },
    "scope": {
      "type": "object",
      "properties": {
        "environment": {
          "type": "string",
          "const": "authorized-lab"
        },
        "target_id": {
          "type": "string",
          "minLength": 1
        },
        "authorization": {
          "type": "string",
          "const": "lab-owner-approved"
        },
        "aws_account_id": {
          "type": "string",
          "pattern": "^\\d{12}$"
        },
        "region": {
          "type": "string",
          "minLength": 1
        }
      },
      "required": [
        "environment",
        "target_id",
        "authorization",
        "aws_account_id",
        "region"
      ]
    },
    "vulnerability": {
      "type": "object",
      "properties": {
        "category": {
          "type": "string",
          "const": "cloud-iam-misconfiguration"
        },
        "cwe": {
          "type": "string",
          "pattern": "^CWE-\\d+$"
        },
        "affected_component": {
          "type": "string",
          "minLength": 1
        },
        "description": {
          "type": "string",
          "minLength": 1
        },
        "root_cause_hypothesis": {
          "type": "string",
          "minLength": 1
        }
      },
      "required": [
        "category",
        "cwe",
        "affected_component",
        "description",
        "root_cause_hypothesis"
      ]
    },
    "target": {
      "type": "object",
      "properties": {
        "principal_arn": {
          "type": "string",
          "pattern": "^arn:aws[a-z-]*:[a-z0-9-]+:[a-z0-9-]*:\\d{0,12}:.+$"
        },
        "role_name": {
          "type": "string",
          "minLength": 1
        },
        "protected_resource_arn": {
          "type": "string",
          "pattern": "^arn:aws[a-z-]*:[a-z0-9-]+:[a-z0-9-]*:\\d{0,12}:.+$"
        },
        "offending_policy": {
          "type": "object",
          "properties": {
            "type": {
              "type": "string",
              "const": "inline"
            },
            "policy_name": {
              "type": "string",
              "minLength": 1
            },
            "statement_sid": {
              "type": "string",
              "minLength": 1
            }
          },
          "required": [
            "type",
            "policy_name",
            "statement_sid"
          ]
        }
      },
      "required": [
        "principal_arn",
        "role_name",
        "protected_resource_arn",
        "offending_policy"
      ]
    },
    "exploit": {
      "type": "object",
      "properties": {
        "starting_position": {
          "type": "string",
          "minLength": 1
        },
        "preconditions": {
          "type": "array",
          "items": {
            "type": "string"
          }
        },
        "steps": {
          "minItems": 1,
          "type": "array",
          "items": {
            "type": "object",
            "properties": {
              "step": {
                "type": "integer",
                "exclusiveMinimum": 0,
                "maximum": 9007199254740991
              },
              "action": {
                "type": "string",
                "minLength": 1
              },
              "expected_observation": {
                "type": "string",
                "minLength": 1
              }
            },
            "required": [
              "step",
              "action",
              "expected_observation"
            ]
          }
        },
        "success_condition": {
          "type": "string",
          "minLength": 1
        },
        "observed_result": {
          "type": "string",
          "const": "success"
        },
        "replay": {
          "type": "object",
          "properties": {
            "type": {
              "type": "string",
              "const": "aws_api"
            },
            "assume_role_arn": {
              "type": "string",
              "pattern": "^arn:aws[a-z-]*:[a-z0-9-]+:[a-z0-9-]*:\\d{0,12}:.+$"
            },
            "action": {
              "type": "string",
              "pattern": "^[a-z0-9-]+:[A-Za-z0-9*]+$"
            },
            "resource": {
              "type": "string",
              "pattern": "^arn:aws[a-z-]*:[a-z0-9-]+:[a-z0-9-]*:\\d{0,12}:.+$"
            }
          },
          "required": [
            "type",
            "assume_role_arn",
            "action",
            "resource"
          ]
        }
      },
      "required": [
        "starting_position",
        "preconditions",
        "steps",
        "success_condition",
        "observed_result",
        "replay"
      ]
    },
    "evidence": {
      "type": "object",
      "properties": {
        "reproduction_count": {
          "type": "integer",
          "exclusiveMinimum": 0,
          "maximum": 9007199254740991
        },
        "successful_reproductions": {
          "type": "integer",
          "minimum": 0,
          "maximum": 9007199254740991
        },
        "artifacts": {
          "type": "array",
          "items": {
            "type": "string"
          }
        },
        "confidence": {
          "type": "number",
          "minimum": 0,
          "maximum": 1
        }
      },
      "required": [
        "reproduction_count",
        "successful_reproductions",
        "artifacts",
        "confidence"
      ]
    },
    "remediation": {
      "type": "object",
      "properties": {
        "desired_security_property": {
          "type": "string",
          "minLength": 1
        },
        "suggested_fix": {
          "type": "string",
          "minLength": 1
        },
        "constraints": {
          "type": "array",
          "items": {
            "type": "string"
          }
        }
      },
      "required": [
        "desired_security_property",
        "suggested_fix",
        "constraints"
      ]
    },
    "verification": {
      "type": "object",
      "properties": {
        "negative_test": {
          "type": "string",
          "minLength": 1
        },
        "positive_test": {
          "type": "string",
          "minLength": 1
        },
        "regression_test": {
          "type": "string",
          "minLength": 1
        },
        "checks": {
          "minItems": 2,
          "type": "array",
          "items": {
            "type": "object",
            "properties": {
              "id": {
                "type": "string",
                "minLength": 1
              },
              "kind": {
                "type": "string",
                "enum": [
                  "negative",
                  "positive",
                  "regression"
                ]
              },
              "description": {
                "type": "string"
              },
              "action": {
                "type": "string",
                "pattern": "^[a-z0-9-]+:[A-Za-z0-9*]+$"
              },
              "resource": {
                "type": "string",
                "pattern": "^arn:aws[a-z-]*:[a-z0-9-]+:[a-z0-9-]*:\\d{0,12}:.+$"
              },
              "expect": {
                "type": "string",
                "enum": [
                  "allow",
                  "deny"
                ]
              }
            },
            "required": [
              "id",
              "kind",
              "action",
              "resource",
              "expect"
            ]
          }
        }
      },
      "required": [
        "negative_test",
        "positive_test",
        "regression_test",
        "checks"
      ]
    },
    "handoff": {
      "type": "object",
      "properties": {
        "owner": {
          "type": "string",
          "const": "remediation-agent"
        },
        "state": {
          "type": "string",
          "const": "ready-for-remediation"
        },
        "created_at": {
          "type": "string",
          "format": "date-time",
          "pattern": "^(?:(?:\\d\\d[2468][048]|\\d\\d[13579][26]|\\d\\d0[48]|[02468][048]00|[13579][26]00)-02-29|\\d{4}-(?:(?:0[13578]|1[02])-(?:0[1-9]|[12]\\d|3[01])|(?:0[469]|11)-(?:0[1-9]|[12]\\d|30)|(?:02)-(?:0[1-9]|1\\d|2[0-8])))T(?:(?:[01]\\d|2[0-3]):[0-5]\\d:[0-5]\\d(?:\\.\\d+)?(?:Z))$"
        }
      },
      "required": [
        "owner",
        "state",
        "created_at"
      ]
    }
  },
  "required": [
    "schema_version",
    "finding_id",
    "title",
    "status",
    "severity",
    "scope",
    "vulnerability",
    "target",
    "exploit",
    "evidence",
    "remediation",
    "verification",
    "handoff"
  ]
}
